title,source_url,content
Business Dress Code Policy,https://resources.workable.com/dress-code-company-policy,"""## **Policy brief & purpose** Our **dress code company policy** outlines how we expect our employees to dress at work. Employees should note that their appearance matters when representing our company in front of clients, visitors or other parties. An employee’s appearance can create a positive or negative impression that reflects on our company and culture. ## **Scope** This policy applies to all our employees. ## **Policy elements** These dress code rules always apply: - All employees must be clean and well-groomed. Grooming styles dictated by religion and ethnicity aren’t restricted. - All clothes must be work-appropriate. Clothes that are typical in workouts and outdoor activities aren’t allowed. - All clothes must project professionalism. Clothes that are too revealing or inappropriate aren’t allowed. - All clothes must be clean and in good shape. Discernible rips, tears or holes aren’t allowed. - Employees must avoid clothes with stamps that are offensive or inappropriate. ### **What is Business Dress Code?** Our company’s official dress code is \[ _Business/ Business Casual/ Smart Casual/ Casual._ \] We may change our dress code in special cases. For example, we may require employees to wear semi-formal attire for an event. Then, both male and female employees should wear suits, ties, white shirts and appropriate shoes. Our company may also introduce \[_dress-down Friday_\] when employees can wear more casual clothing like jeans, simple blouses and boots. This won’t apply if employees are meeting with clients, partners and other external parties. An employee’s position may inform their dress code. If employees frequently meet with clients or prospects, they should conform to a business dress code. ## **Disciplinary Consequences** When an employee disregards our dress code, their supervisor should reprimand them. The employee should start respecting our dress code immediately. In some cases, supervisors may ask employees to returning home to change. Employees may face more severe consequences up to and [including termination](https://resources.workable.com/dress-code-company-policy), if: - Their appearance causes irreparable damage, like loss of a major client. - They repeatedly violate our dress code."""
Cyber Security Policy,https://resources.workable.com/cyber-security-policy,"""## **Policy brief & purpose** Our company cyber security policy outlines our guidelines and provisions for preserving the [security of our data](https://resources.workable.com/data-protection-company-policy) and technology infrastructure. The more we rely on technology to collect, store and manage information, the more vulnerable we become to severe security breaches. Human errors, hacker attacks and system malfunctions could cause great financial damage and may jeopardize our company’s reputation. For this reason, we have implemented a number of security measures. We have also prepared instructions that may help mitigate security risks. We have outlined both provisions in this policy. ## **Scope** This policy applies to all our employees, contractors, volunteers and anyone who has permanent or temporary access to our systems and hardware. ## **Policy elements** ### **Confidential data** [Confidential data](https://resources.workable.com/confidentiality-company-policy) is secret and valuable. Common examples are: - Unpublished financial information - Data of customers/partners/vendors - Patents, formulas or new technologies - Customer lists (existing and prospective) All employees are obliged to protect this data. In this policy, we will give our employees instructions on how to avoid security breaches. ### **Protect personal and company devices** When employees use their [digital devices](https://resources.workable.com/cell-phone-company-policy) to access company emails or accounts, they introduce security risk to our data. We advise our employees to keep both their personal and company-issued computer, tablet and cell phone secure. They can do this if they: - Keep all devices password protected. - Choose and upgrade a complete antivirus software. - Ensure they do not leave their devices exposed or unattended. - Install security updates of browsers and systems monthly or as soon as updates are available. - Log into company accounts and systems through secure and private networks only. We also advise our employees to avoid accessing internal systems and accounts from other people’s devices or lending their own devices to others. When new hires receive company-issued equipment they will receive instructions for: - \[_Disk encryption setup_\] - \[_Password management tool setup_\] - \[_Installation of antivirus/ anti-malware software_\] They should follow instructions to protect their devices and refer to our \[_Security Specialists/ Network Engineers_\] if they have any questions. ### **Keep emails safe** [Emails](https://resources.workable.com/email-usage-policy-template) often host scams and malicious software (e.g. worms.) To avoid virus infection or data theft, we instruct employees to: - Avoid opening attachments and clicking on links when the content is not adequately explained (e.g. “watch this video, it’s amazing.”) - Be suspicious of clickbait titles (e.g. offering prizes, advice.) - Check email and names of people they received a message from to ensure they are legitimate. - Look for inconsistencies or give-aways (e.g. grammar mistakes, capital letters, excessive number of exclamation marks.) If an employee isn’t sure that an email they received is safe, they can refer to our \[_IT Specialist_.\] ### **Manage passwords properly** Password leaks are dangerous since they can compromise our entire infrastructure. Not only should passwords be secure so they won’t be easily hacked, but they should also remain secret. For this reason, we advice our employees to: - Choose passwords with at least eight characters (including capital and lower-case letters, numbers and symbols) and avoid information that can be easily guessed (e.g. birthdays.) - Remember passwords instead of writing them down. If employees need to write their passwords, they are obliged to keep the paper or digital document confidential and destroy it when their work is done. - Exchange credentials only when absolutely necessary. When exchanging them in-person isn’t possible, employees should prefer the phone instead of email, and only if they personally recognize the person they are talking to. - Change their passwords every two months. Remembering a large number of passwords can be daunting. We will purchase the services of a password management tool which generates and stores passwords. Employees are obliged to create a secure password for the tool itself, following the abovementioned advice. ### **Transfer data securely** Transferring data introduces security risk. Employees must: - Avoid transferring sensitive data (e.g. customer information, employee records) to other devices or accounts unless absolutely necessary. When mass transfer of such data is needed, we request employees to ask our \[_Security Specialists_\] for help. - Share confidential data over the company network/ system and not over public Wi-Fi or private connection. - Ensure that the recipients of the data are properly authorized people or organizations and have adequate security policies. - Report scams, privacy breaches and hacking attempts Our \[_IT Specialists/ Network Engineers_\] need to know about scams, breaches and malware so they can better protect our infrastructure. For this reason, we advise our employees to report perceived attacks, suspicious emails or phishing attempts as soon as possible to our specialists. Our \[_IT Specialists/ Network Engineers_\] must investigate promptly, resolve the issue and send a companywide alert when necessary. Our Security Specialists are responsible for advising employees on how to detect scam emails. We encourage our employees to reach out to them with any questions or concerns. ### **Additional measures** To reduce the likelihood of security breaches, we also instruct our employees to: - Turn off their screens and lock their devices when leaving their desks. - Report stolen or damaged equipment as soon as possible to \[_HR/ IT Department_\]. - Change all account passwords at once when a device is stolen. - Report a perceived threat or possible security weakness in company systems. - Refrain from downloading suspicious, unauthorized or illegal software on their company equipment. - Avoid accessing suspicious websites. We also expect our employees to comply with our [social media](https://resources.workable.com/social-media-company-policy) and [internet usage policy](https://resources.workable.com/internet-usage-policy). Our \[_Security Specialists/ Network Administrators_\] should: - Install firewalls, anti malware software and access authentication systems. - Arrange for security training to all employees. - Inform employees regularly about new scam emails or viruses and ways to combat them. - Investigate security breaches thoroughly. - Follow this policies provisions as other employees do. Our company will have all physical and digital shields to protect information. ### **Remote employees** [Remote employees](https://resources.workable.com/remote-work-policy) must follow this policy’s instructions too. Since they will be accessing our company’s accounts and systems from a distance, they are obliged to follow all data encryption, protection standards and settings, and ensure their private network is secure. We encourage them to seek advice from our \[_Security Specialists/ IT Administrators._\] ## **Disciplinary Action** We expect all our employees to always follow this policy and those who cause security breaches may face disciplinary action: - First-time, unintentional, small-scale security breach: We may issue a verbal warning and train the employee on security. - Intentional, repeated or large scale breaches (which cause severe financial or other damage): We will invoke more severe disciplinary action up to and including termination. We will examine each incident on a case-by-case basis. Additionally, employees who are observed to disregard our security instructions will face [progressive discipline](https://resources.workable.com/progressive-discipline-policy), even if their behavior hasn’t resulted in a security breach. ### **Take security seriously** Everyone, from our customers and partners to our employees and contractors, should feel that their data is safe. The only way to gain their trust is to proactively protect our systems and databases. We can all contribute to this by being vigilant and keeping cyber security top of mind."""
Internet Usage Policy,https://resources.workable.com/internet-usage-policy,"""## **Policy brief & purpose** Our employee internet usage policy outlines our guidelines for using our company’s internet connection, network and equipment. We want to avoid inappropriate or illegal internet use that creates risks for our company’s legality and reputation. ## **Scope** This employee internet usage policy applies to all our employees, contractors, volunteers and partners who access our network and computers. ## **Employee internet usage policy elements** ### **What is appropriate employee internet usage?** Our employees are advised to use our company’s internet connection for the following reasons: - To complete their job duties. - To seek out information that they can use to improve their work. - To access their social media accounts, while conforming to our [social media policy](https://resources.workable.com/social-media-company-policy). We don’t want to restrict our employees’ access to websites of their choice, but we expect our employees to exercise good judgement and remain productive at work while using the internet. Any use of our network and connection must follow our [confidentiality](https://resources.workable.com/confidentiality-company-policy) and [data protection policy](http://resources.workable.com/data-protection-company-policy). Employees should: - Keep their passwords secret at all times. - Log into their corporate accounts only from safe devices. - Use strong passwords to log into work-related websites and services. ### **What is inappropriate employee internet usage?** Our employees mustn’t use our network to: - Download or upload obscene, offensive or illegal material. - Send confidential information to unauthorized recipients. - Invade another person’s privacy and sensitive information. - Download or upload movies, music and other copyrighted material and software. - Visit potentially dangerous websites that can compromise the safety of our network and computers. - Perform unauthorized or illegal actions, like hacking, fraud, buying/selling illegal goods and more. We also advise our employees to be careful when downloading and opening/executing files and software. If they’re unsure if a file is safe, they should ask \[_their supervisor/ IT manager/ etc._\] Our company may install anti-virus and disk encryption software on our company computers. Employees may not deactivate or configure settings and firewalls without managerial approval. We won’t assume any responsibility if employee devices are infected by malicious software, or if their personal data are compromised as a result of inappropriate employee use. ### **Company-issued equipment** We expect our employees to respect and protect our company’s equipment. “Company equipment” in this computer usage policy for employees includes company-issued phones, laptops, tablets and any other electronic equipment, and belongs to our company. We advise our employees to lock their devices in their desks when they’re not using them. Our employees are responsible for their equipment whenever they take it out of their offices. ### **Email** Our employees can use their [corporate email accounts](https://resources.workable.com/email-usage-policy-template) for both work-related and personal purposes as long as they don’t violate this policy’s rules. Employees shouldn’t use their corporate email to: - Register to illegal, unsafe, disreputable or suspect websites and services. - Send obscene, offensive or discriminatory messages and content. - Send unauthorized advertisements or solicitation emails. - Sign up for a competitor’s services unless authorized. Our company has the right to monitor corporate emails. We also have the right to monitor websites employees visit on our computers. ## **Disciplinary Action** Employees who don’t conform to this employee internet usage policy will face disciplinary action. Serious violations will be cause for termination of employment, or legal action when appropriate. Examples of serious violations are: - Using our internet connection to steal or engage in other illegal activities. - Causing our computers to be infected by viruses, worms or other malicious software. - Sending offensive or inappropriate emails to our customers, colleagues or partners."""
Cell Phone Company Policy,https://resources.workable.com/cell-phone-company-policy,"""## **Policy brief & purpose** Our **employee cell phone policy** outlines our guidelines for using cell phones at work. We recognize that cell phones (and smartphones especially) have become an integral part of everyday life. They may be a great asset if used correctly (for productivity apps, calendars, business calls etc.) But, cell phones may also cause problems when used imprudently or excessively. ## **Scope** This policy applies to all our employees. ## **Policy elements** Despite their benefits, personal cell phones may cause problems in the workplace. Employees who use their cell phones excessively may: - Get [distracted from their work](https://resources.workable.com/social-media-company-policy). - Disturb colleagues by speaking on their phones. - Cause security issues from inappropriate use of company-issued equipment or [misuse of our company’s internet connection](http://resources.workable.com/internet-usage-policy). - Cause accidents when they illegally use their phones inside company vehicles or near areas where using phones is prohibited. Our company expects employees to use their cellphones prudently during working hours. **We advise our employees to:** - Use company-issued phones for business purposes only and preserve them in perfect condition. - Surf the internet, text and talk on the phone only for a few minutes per day. - Turn off or silence their phones when asked. **We won’t allow employees to:** - Play games on the cell phone during working hours. - Use their phones for any reason while driving a company vehicle. - Use their cell phone’s camera or microphone to record confidential information. - Use their phones in areas where cell use is explicitly prohibited (e.g. laboratories.) - Speak on their phones within earshot of colleagues’ working space during working hours. - Download or upload inappropriate, illegal or obscene material on a company cell phone using a corporate internet connection. ### **How to properly use cell phones in the workplace** Employees can benefit from using cell phones. They’re allowed to use their phones: - To make business calls. - To use productivity apps. - To check important messages. - To make brief personal calls away from the working space of colleagues. Employees can use their phones during [breaks](https://resources.workable.com/employee-breaks-policy-template) or at lunch hour and while on a stationary vehicle. ## **Disciplinary Consequences** Our company retains the right to monitor employees for excessive or inappropriate use of their cell phones. If an employee’s phone usage causes a decline in productivity or interferes with our operations, we’ll ban that employee from using their cell phones. Employees may face severe disciplinary action up to and including [termination](https://resources.workable.com/separation-of-employment-company-policy), in cases when they: - Cause a security breach. - Violate our [confidentiality policy](https://resources.workable.com/confidentiality-company-policy). - Cause an accident by recklessly using their phones."""
Email Usage Policy,https://resources.workable.com/email-usage-policy-template,"""## **Policy brief & purpose** Our corporate email usage policy helps employees use their company email addresses appropriately. Email is essential to our everyday jobs. We want to ensure that our employees understand the limitations of using their corporate email accounts. Our goal is to protect our confidential data from breaches and safeguard our reputation and technological property. ## **Scope** This policy applies to all employees, vendors and partners who are assigned (or given access to) a corporate email. This email may be assigned to an individual (e.g. employeename@companydomain) or department (e.g. <hr@companydomain.com>.) ## **Policy elements** Corporate emails are powerful tools that help employees in their jobs. Employees should use their company email primarily for work-related purposes. However, we want to provide employees with some freedom to use their emails for personal reasons. We will define what constitutes appropriate and inappropriate use. ### **Inappropriate use of company email** Our employees represent our company whenever they use their corporate email address. They must not: - Sign up for illegal, unreliable, disreputable or suspect websites and services. - Send unauthorized marketing content or solicitation emails. - Register for a competitor’s services unless authorized. - Send insulting or discriminatory messages and content. - Intentionally spam other people’s emails, including their coworkers. Our company has the right to monitor and archive corporate emails. ### **Appropriate use of corporate email** Employees are allowed to use their corporate email for work-related purposes without limitations. For example, employees can use their email to: - Communicate with current or prospective customers and partners. - Log in to purchased software they have legitimate access to. - Give their email address to people they meet at conferences, career fairs or other corporate events for business purposes. - Sign up for newsletters, platforms and other online services that will help them with their jobs or professional growth. ### **Personal use** Employees are allowed to use their corporate email for some personal reasons. For example, employees can use their corporate email to: - Register for classes or meetups. - Send emails to friends and family as long as they don’t spam or disclose confidential information. - Download ebooks, guides and other content for their personal use as long as it is safe and appropriate. Employees must adhere to this policy at all times, in addition to our [confidentiality](https://resources.workable.com/confidentiality-company-policy) and [data protection](https://resources.workable.com/data-protection-company-policy) guidelines. ### **Email security** Email is often the medium of hacker attacks, confidentiality breaches, viruses and other malware. These issues can compromise our reputation, legality and security of our equipment. Employees must: - Select strong passwords with at least eight characters (capital and lower-case letters, symbols and numbers) without using personal information (e.g. birthdays.) - Remember passwords instead of writing them down and keep them secret. - Change their email password every two months. Also, employees should always be vigilant to catch emails that carry malware or phishing attempts. We instruct employees to: - Avoid opening attachments and clicking on links when content is not adequately explained (e.g. “Watch this video, it’s amazing.”) - Be suspicious of clickbait titles. - Check email and names of unknown senders to ensure they are legitimate. - Look for inconsistencies or style red flags (e.g. grammar mistakes, capital letters, excessive number of exclamation marks.) If an employee isn’t sure that an email they received is safe, they can ask our \[_Security Specialists_.\] We remind our employees to keep their anti-malware programs updated. ### **Email signature** We encourage employees to create an email signature that exudes professionalism and represents our company well. Salespeople and executives, who represent our company to customers and stakeholders, should pay special attention to how they close emails. Here’s a template of an acceptable email signature: _\[Employee Name\]_ _\[Employee Title\], \[Company Name with link\]_ _\[Phone number\] | \[Company Address\]_ Employees may also include professional images, company logos and work-related videos and links in email signatures. If they are unsure how to do so, they can ask for help from our Office Manager or their supervisor. ## **Disciplinary action** Employees who don’t adhere to the present policy will face disciplinary action up to and including termination. Example reasons for termination are: - Using a corporate email address to send confidential data without authorization. - Sending offensive or inappropriate emails to our customers, colleagues or partners. - Using a corporate email for an illegal activity."""
