title,source_url,content
Social Media Company Policy,https://resources.workable.com/social-media-company-policy,"""## **What is a corporate social media policy?** Most of your employees are likely to use one or more social platforms. Whatever they post on their personal accounts can be a potential risk for your company (e.g. if they share sensitive information). And, more importantly, using social media at work can affect productivity and focus. This is one of the reasons you need a company social media policy – to address limitations on what employees can post and to potentially place restrictions on social media use inside the workplace. The other reason is your own social media profile; as an organization, you’ll want to have a consistent voice on your social media and want to avoid posting potentially risky statements or information. A social media policy for employees can give them the instructions they need to know how to handle corporate accounts. **How restrictive should my company social media policy be?** Your employees own their social media profiles, so what they post there can’t be restricted by your organization. You can, however, provide them with reasonable guidelines about what they shouldn’t post about (e.g. confidential data) and provide any potential disciplinary actions if their posts affect your company’s image (e.g. hate speech). As far as your own company’s social media accounts are concerned, you’re entitled to set the rules of posting. ## **How do I distribute it?** Your social media policy should be part of your [employee handbook](https://resources.workable.com/employee-handbook-policies) or live inside your policy database (e.g. in your HRIS). Make sure all employees have read it, especially those in your social media team. Of course, remember that this policy is a living document – this is because the social media landscape changes often, new rules and regulations about privacy are introduced and trends can also play a part (e.g. the #metoo movement). Make sure you keep up-to-date with changes and think about whether your company social media policy might need some revamping. Here’s a simple social media policy template to get you started with the essentials: ## **Policy brief & purpose** Our **social media company policy** provides a framework for using social media. Social media is a place where people exchange information, opinions and experiences to learn, develop and have fun. Whether you’re handling a corporate account or using one of your own, you should remain productive and avoid damaging our organization in any way. This policy provides practical advice to avoid issues that might arise by careless use of social media in the workplace. ## **Scope** We expect all our employees to follow this policy. Also, by “social media”, we refer to a variety of online communities like blogs, social networks, chat rooms and forums – not just platforms like Facebook or Twitter. This policy is built around two different elements: one, using personal social media at work and two, representing our company through social media. ## **Policy elements** ### **Using personal social media** We _\[allow\]_ our employees to access their personal accounts at work. But, we expect you to act responsibly and ensure your productivity isn't affected. Whether you’re using your accounts for business or personal purposes, you may easily get sidetracked by the vast amount of available content. So, please restrict your use to a few minutes per work day. We ask you to be careful when posting on social media, too. We can’t restrict what you post there, but we expect you to adhere to our confidentiality policies at all times. We also caution you to avoid violating our anti-harassment policies or posting something that might make your collaboration with your colleagues more difficult (e.g. hate speech against groups where colleagues belong to). In general, please: #### **We advise our employees to:** - **Ensure others know that your personal account or statements don’t represent our company.** You shouldn’t state or imply that your personal opinions and content are authorized or endorsed by our company. We advise using a disclaimer such as “opinions are my own” to avoid misunderstandings. - **Avoid sharing intellectual property** like trademarks on a personal account without approval. Confidentiality policies and laws always apply. - **Avoid any defamatory, offensive or derogatory content.** It may be considered as a violation of our company’s anti-harassment policy, if directed towards colleagues, clients or partners. ### **Representing our company** Some employees represent our company by handling corporate social media accounts or speak on our company’s behalf. When you’re sitting behind a corporate social media account, we expect you to act carefully and responsibly to protect our company’s image and reputation. You should: - **Be respectful, polite and patient,** when engaging in conversations on our company's behalf. You should be extra careful when making declarations or promises towards customers and stakeholders. - **Avoid speaking on matters outside your field of expertise** when possible. Everyone should be careful not to answer questions or make statements that fall under somebody else’s responsibility. - **Follow our** [**confidentiality policy**](https://resources.workable.com/confidentiality-company-policy) **and** [**data protection policy**](https://resources.workable.com/data-protection-company-policy) and observe laws on copyright, trademarks, plagiarism and fair use. - **Inform our \[_PR/Marketing department_\]** when you're about to share any major-impact content. - **Avoid deleting or ignoring comments** for no reason. They should listen and reply to criticism. - **Never post discriminatory, offensive or libelous** content and commentary. - **Correct or remove** any misleading or false content as quickly as possible. ## **Disciplinary Consequences** We'll monitor all social media postings on our corporate account. We may have to take disciplinary action leading up to and including termination if employees do not follow this policy's guidelines. Examples of non-conformity with the employee social media policy include but are not limited to: - Disregarding job responsibilities and deadlines to use social media at work. - Disclosing confidential information through personal or corporate accounts. - Directing offensive comments towards other members of the online community. If you violate this policy inadvertently, you may receive a reprimand. We expect you to comply after that, or stricter [disciplinary actions](https://resources.workable.com/progressive-discipline-policy) will apply."""
Conflict Of Interest Company Policy,https://resources.workable.com/conflict-of-interest-company-policy,"""## **Policy brief & purpose** Our company **Conflict of Interest Policy** refers to any case where an employee’s personal interest might contradict the interest of the company they work for. This is an unwanted circumstance as it may have heavy implications on the employee’s judgement and commitment to the company, and by extension to the realization of its goals. This policy will outline the rules regarding conflict of interest and the responsibilities of employees and the company in resolving any such discrepancies. ## **Scope** This company conflict of interest policy applies to all prospective or current employees of the company, as well as independent contractors and persons acting on behalf of the company. ## **Policy elements** The relationship of the company with its employees should be based on mutual trust. As the company is committed to preserve the interests of people under its employment, it expects them to act only towards its own fundamental interests. Conflict of interest may occur whenever an employee’s interest in a particular subject may lead them to actions, activities or relationships that undermine the company and may place it to disadvantage. ### **What is an employee conflict of interest?** This situation may take many different forms that include, but are not limited to, conflict of interest examples: - Employees’ ability to use their position with the company to their personal advantage - Employees engaging in activities that will bring direct or indirect profit to a competitor - Employees owning shares of a competitor’s stock - Employees using connections obtained through the company for their own private purposes - Employees using company equipment or means to support an external business - Employees acting in ways that may compromise the company’s legality (e.g. taking bribes or bribing representatives of legal authorities) The possibility that a conflict of interest may occur can be addressed and resolved before any actual damage is done. Therefore, when an employee understands or suspects that a conflict of interest exists, they should bring this matter to the attention of management so corrective actions may be taken. Supervisors must also keep an eye on potential conflict of interests of their subordinates. The responsibility of resolving a conflict of interest starts from the immediate supervisor and may reach senior management. All conflicts of interest will be resolved as fairly as possible. Senior management has the responsibility of the final decision when a solution can not be found. In general, employees are advised to refrain from letting personal and/or financial interests and external activities come into opposition with the company’s fundamental interests. Note: _The same principles apply to the company in regards to its clients. When applicable, we are committed to not offer services or form partnerships with companies who are in direct competition with one of our existing clients._ ## **Disciplinary Consequences** In cases when a conflict of interest is deliberately concealed or when a solution can not be found, disciplinary action may be invoked up to and including termination."""
Fraternization Policy,https://resources.workable.com/fraternization-policy,"""## **Policy brief & purpose** Our Fraternization policy outlines our guidelines on employees forming personal relationships with each other. We don’t want to place undue restrictions on employees dating colleagues, as we acknowledge that freedom of choosing one’s partner is an individual’s right. But, without rules and guidelines, romantic relationships between colleagues may negatively impact our workplace. This policy will set restrictions to maintain workplace conduct and order. Friendships forming between employees are also included in this policy. Friendships allow for a more collaborative environment, but they might also occasionally create cliques and fragmentation inside departments. This policy does not restrict participating in labor unions or other labor or civil rights organizations. ## **Scope** This policy applies to all our employees regardless of gender or sexual orientation. For the purposes of this policy, “dating” includes consensual romantic relationships and sexual relations. Non-consensual relationships constitute [sexual harassment](https://resources.workable.com/workplace-harassment-company-policy) and we prohibit them explicitly. ## **Policy elements** ### **Dating in the workplace** Dating colleagues may cause problems if not handled correctly. Examples of common concerns are: - Colleagues who date might spend a large portion of their work time talking or meeting with each other instead of completing their duties. - Fights or breakups between couples might affect their ability to collaborate or maintain peace in the workplace. - Employees who dated supervisors might sue for sexual harassment if they are terminated. - Employees who date executives might unfairly benefit from favoritism. So, we advise our employees to: - Consider any possible [conflict of interest](https://resources.workable.com/conflict-of-interest-company-policy) before they enter into a relationship with a coworker. - Inform HR when they enter into a romantic or intimate relationship with a colleague. - Keep discussions of personal issues out of the workplace. - Seek counseling from HR or specialized employees (e.g. psychologist) if needed. - Maintain professionalism despite the status of the relationship and seek advice from their managers or HR to solve any issues. When serious problems arise between couples, they can arrange a meeting with HR or their manager to find a solution. Example of a possible solution is to consult with and transfer an employee to a different division, without loss of benefits or compensation. #### **Unacceptable and acceptable behavior** When two employees are in a relationship with one another, they should behave appropriately in the workplace. We define unacceptable behavior as any action that: - Offends our people. - Disrupts or hinders our operations. - Distracts our employees from their duties. - Decreases our employees’ individual performance. Examples of acceptable behavior for employees are: - Passing by their partner’s office to talk to them for non-work reasons for a short time. - Displaying affection discreetly and infrequently while on company premises. - Discussing their plans as a couple during breaks or lunch hours (with or without colleagues.) - Coming to and leaving from work together. Examples of unacceptable behavior for employees are: - Arguing in the workplace during or after working hours. - Kissing or touching inappropriately in front of colleagues. - Exchanging an excessive number of instant messages or calls unrelated to their work during working hours. - Making their colleagues uncomfortable by talking or boasting about the relationship during working hours. Employees who exhibit unacceptable behavior will face progressive discipline, up to and including termination in cases of repeated violations. HR is responsible for determining appropriate penalties. Employees are also obliged to behave appropriately towards their colleagues who date each other. We prohibit [victimization](https://resources.workable.com/no-retaliation-company-policy) and [hostility](https://resources.workable.com/workplace-violence-company-policy) towards employees for any reason. This includes sexual jokes, gossip and improper comments. Employees who witness this kind of behavior should report it to HR. Employees are obliged to follow our [Code of Conduct](https://resources.workable.com/employee-code-of-conduct-company-policy) at all times. #### **Dating managers** To avoid accusations of favoritism, abuse of authority and sexual harassment, we prohibit supervisors from dating employees who report to them. This restriction may extend to every manager within two levels above an employee, regardless of team or department to facilitate moving or promoting employees. Supervisors are strictly forbidden from dating their direct reports. If this occurs, the supervisor may face disciplinary action up to and including termination. This rule may be less strict in cases when managers enter into a consenting relationship with an employee from another team or department. When this happens, they must inform HR as soon as possible. It’s to their best interest not to conceal their relationship as they may provoke disciplinary action if and when they are discovered. HR will evaluate the situation and act accordingly (e.g. transfer an employee or prepare a [“love contract”](https://www.shrm.org/hr-today/news/hr-magazine/pages/2tyler-love%20contracts.aspx) to ensure the relationship is consensual.) Employees will not face demotion, victimization or loss of benefits if we have to transfer them to another team or department. The supervisor may be reprimanded depending on the circumstances. We may terminate those who repeatedly disregard this restriction. #### **Couples who are married or in a domestic partnership** Employees who enter in an official relationship with another employee after they’re both hired by our company should follow the rules outlined above. A married employee (or an employee who has a domestic partner) who serves as hiring manager for their team is not allowed to consider hiring their partner for open roles. This might bring about questions of favoritism in the hiring process. They are allowed to refer their partner for employment to other teams or departments for which they don’t have any managerial or hiring authority. If we discover that a hiring manager hired their partner, HR may move one of them to another team or branch where one won’t supervise the other. The hiring manager will receive a reprimand, as their hiring decision may have compromised our company’s commitment to [equal opportunity](https://resources.workable.com/equal-opportunity-company-policy) and avoiding favoritism. ### **Friendships in the workplace** Employees who work together may naturally form friendships either in or out of their workplace. We encourage this relationship between peers, as it can help employees communicate, collaborate and preserve harmony while working. However, we must consider the negative consequences of forming this kind of personal relationship. Employees who are friends might occasionally: - Enter into disputes over borrowed money. - Gossip about colleagues and acquaintances. - Form cliques that exclude certain colleagues and bring discord. - Prevent one another (whether directly or indirectly) from accepting promotions or relocations for the sake of their friendship. To mitigate possible issues, we advise our employees to: - Discuss non-work related issues outside of the workplace. - Ask for their managers or HR’s help when they are unable to resolve an issue or conflict of interest. - Follow our Code of Conduct and act professionally at all times. - Focus on their work instead of their friendships while at the office. #### **Friendships with supervisors** Being friends with one’s manager may have both positive and negative consequences. On one hand, friendship might facilitate honesty, trust and job satisfaction for both parties. But, friendship might also make managers and employees confused about how they should treat each other. Questions of favoritism might arise too, and result in negative feelings and loss of morale. For these reasons, we discourage employees being friends with their managers. We do encourage a harmonious and open relationship, but we think it’s to everyone’s best interest if managers are not involved with their direct reports outside of the workplace. ### **Openness** The key point of this policy is openness. We can’t stop employees from forming relationships with one another and trying to prohibit them from doing so could incite deceit, resentment and gossip. For this reason, we expect our employees to be open about their personal relationships with colleagues. This does not mean that employees should draw attention to their relationship. But, keeping work relationships secret may negatively impact all parties involved. HR will be at our employees’ disposal to explain our policy, attitude and course of action in cases of violation. ### **Our company’s commitment** Just like we expect employees to comply with this policy, our company has responsibilities that we are obliged to follow. We will: - Enforce this policy to HR and senior management as well as employees. - Treat everyone equally when taking disciplinary action without discriminating against protected characteristics. - Prohibit victimization, [violence](https://resources.workable.com/workplace-violence-company-policy) and [retaliation](https://resources.workable.com/no-retaliation-company-policy) of any kind. - Examine each situation separately and consider all aspects and perspectives before making decisions. Our employees should follow our [anti-discrimination policy](https://resources.workable.com/equal-opportunity-company-policy) at all times. For example, HR must not penalize a homosexual couple differently than a heterosexual couple when they both have violated the present policy in the same manner. Likewise, if a team member is discovered to have a relationship with their manager, the person who will be transferred or terminated must not be chosen based on their gender. We will keep our employees’ freedom and individual rights in mind and follow the law."""
Employment Of Relatives Company Policy,https://resources.workable.com/employment-of-relatives-company-policy,"""## **Policy brief & purpose** Our sample **employment of relatives policy** demonstrates our attitude towards nepotism and employing people who are related either by blood or marriage. We won't reject a suitable job candidate on grounds of their relation to a current employee. However, we recognize that encouraging the employment of relatives may have a negative impact on productivity and fuel accusations of nepotism and favoritism. This policy aims to minimize these risks. ## **Scope** This policy applies to all employees regardless of status, position or department. ## **Policy elements** We use the term “relatives” to refer to any person who has a relation by blood or marriage within the third degree with our employee. We also include people who live together in a domestic partnership or children who were adopted. This includes: parents, step-parents, grandparents, in-laws, spouses or domestic partners, children, step-children, adoptive children, grandchildren, siblings, uncles, aunts, nieces and nephews. We aim to keep our hiring process free of discrimination. We may hire a person who is related to one of our current employees if we consider that person the best fit for a position. We may also accept referrals from employees. ### **What is nepotism in the workplace?** Favoritism or conflict of interest may occur when manager are involved in a process with their relatives. Examples are when: - Managers decide which team member to promote. - Managers decide which contracts to renew. - Managers complete performance reviews. - Managers [discipline](https://resources.workable.com/progressive-discipline-policy) their relative. - Managers are part of a hiring committee. To avoid such incidents or suspicions of favoritism and conflict of interest, we established anti-nepotism policies: - Employees who are related must not be involved in a supervisory/reporting relationship with one another. - Employees can not be transferred, promoted or hired inside a reporting relationship with a relative. - Employees can not be part of a hiring committee, when a relative is considered for the position. Please report any relationship with a relative to HR, if you find yourself in a reporting relationship with that relative or in a hiring committee that considers that relative for employment. If you don't, you may face disciplinary action. If two employees who are in a reporting relationship become relatives in the course of their employment, one of the two must be transferred. We may give our employees time to discuss and choose which of them will be transferred, before management makes a final decision. Transfers will be discrimination-free. For example, the person being transferred must not always be a woman. This will violate our anti-discrimination policy. We ask you to act professionally when working with a relative and seek counsel from your manager or HR if there are any problems. ## **Disciplinary Consequences** If a previously unreported relative relationship is discovered between a manager and a team member one of them will be transferred. If incidents of favoritism or conflict of interest have occurred, both employees will be subjected to disciplinary actions that range from reprimand to [termination for cause](https://resources.workable.com/separation-of-employment-company-policy)."""
